{
  "title": "从写代码到定义问题",
  "summary": "提出编码自动化可能提升问题定义与验收能力的重要性。",
  "type": "idea",
  "tags": [
    "AI开发",
    "职业"
  ],
  "keywords": [
    "问题定义",
    "结果验收"
  ],
  "importance": 3,
  "relations": [
    {
      "targetId": "22222222-2222-4222-8222-222222222222",
      "type": "related_to",
      "reason": "两条材料都讨论需求清晰度和自动化产出。",
      "score": 0.78,
      "evidence": [
        {
          "itemId": "11111111-1111-4111-8111-111111111111",
          "quote": "清楚地定义问题和验收结果"
        },
        {
          "itemId": "22222222-2222-4222-8222-222222222222",
          "quote": "需求不清楚时"
        }
      ]
    }
  ]
}
